[{"tag_name":"Nightly-01022026","name":"Nightly 01/02/2026","prerelease":true,"published_at":"2026-02-01T17:37:28Z","html_url":"https://github.com/Kotatsu-Redo/Kotatsu-Redo/releases/tag/Nightly-01022026","assets":[{"name":"app-release.apk","size":14225280,"browser_download_url":"https://github.com/Kotatsu-Redo/Kotatsu-Redo/releases/download/Nightly-01022026/app-release.apk","content_type":"application/vnd.android.package-archive","download_count":40}]},{"tag_name":"9.6.2","name":"Kotatsu 9.6.2","prerelease":false,"published_at":"2026-02-01T07:05:58Z","html_url":"https://github.com/Kotatsu-Redo/Kotatsu-Redo/releases/tag/9.6.2","assets":[{"name":"app-release.apk","size":14224699,"browser_download_url":"https://github.com/Kotatsu-Redo/Kotatsu-Redo/releases/download/9.6.2/app-release.apk","content_type":"application/vnd.android.package-archive","download_count":1372}]},{"tag_name":"9.6.1","name":"Kotatsu 9.6.1","prerelease":false,"published_at":"2026-01-20T20:16:27Z","html_url":"https://github.com/Kotatsu-Redo/Kotatsu-Redo/releases/tag/9.6.1","assets":[{"name":"app-release.apk","size":14221677,"browser_download_url":"https://github.com/Kotatsu-Redo/Kotatsu-Redo/releases/download/9.6.1/app-release.apk","content_type":"application/vnd.android.package-archive","download_count":5255}]},{"tag_name":"Nightly-12012026","name":"Nightly 12/01/2026","prerelease":true,"published_at":"2026-01-12T20:48:19Z","html_url":"https://github.com/Kotatsu-Redo/Kotatsu-Redo/releases/tag/Nightly-12012026","assets":[{"name":"app-release.apk","size":14209618,"browser_download_url":"https://github.com/Kotatsu-Redo/Kotatsu-Redo/releases/download/Nightly-12012026/app-release.apk","content_type":"application/vnd.android.package-archive","download_count":374}]},{"tag_name":"Nightly-11012026","name":"Nightly 11/01/2026","prerelease":true,"published_at":"2026-01-11T15:43:20Z","html_url":"https://github.com/Kotatsu-Redo/Kotatsu-Redo/releases/tag/Nightly-11012026","assets":[{"name":"app-release.apk","size":14209589,"browser_download_url":"https://github.com/Kotatsu-Redo/Kotatsu-Redo/releases/download/Nightly-11012026/app-release.apk","content_type":"application/vnd.android.package-archive","download_count":10}]},{"tag_name":"9.6.0","name":"Kotatsu 9.6.0","prerelease":false,"published_at":"2026-01-09T18:15:30Z","html_url":"https://github.com/Kotatsu-Redo/Kotatsu-Redo/releases/tag/9.6.0","assets":[{"name":"app-release.apk","size":14206680,"browser_download_url":"https://github.com/Kotatsu-Redo/Kotatsu-Redo/releases/download/9.6.0/app-release.apk","content_type":"application/vnd.android.package-archive","download_count":4266}]},{"tag_name":"9.5.9","name":"Kotatsu 9.5.9","prerelease":false,"published_at":"2026-01-08T15:05:33Z","html_url":"https://github.com/Kotatsu-Redo/Kotatsu-Redo/releases/tag/9.5.9","assets":[{"name":"app-release.apk","size":14204645,"browser_download_url":"https://github.com/Kotatsu-Redo/Kotatsu-Redo/releases/download/9.5.9/app-release.apk","content_type":"application/vnd.android.package-archive","download_count":1157}]},{"tag_name":"9.5.8","name":"Kotatsu 9.5.8","prerelease":false,"published_at":"2026-01-04T16:48:58Z","html_url":"https://github.com/Kotatsu-Redo/Kotatsu-Redo/releases/tag/9.5.8","assets":[{"name":"app-release.apk","size":14201357,"browser_download_url":"https://github.com/Kotatsu-Redo/Kotatsu-Redo/releases/download/9.5.8/app-release.apk","content_type":"application/vnd.android.package-archive","download_count":2126}]},{"tag_name":"9.5.7","name":"Kotatsu 9.5.7","prerelease":false,"published_at":"2025-12-29T13:06:56Z","html_url":"https://github.com/Kotatsu-Redo/Kotatsu-Redo/releases/tag/9.5.7","assets":[{"name":"app-release.apk","size":14188843,"browser_download_url":"https://github.com/Kotatsu-Redo/Kotatsu-Redo/releases/download/9.5.7/app-release.apk","content_type":"application/vnd.android.package-archive","download_count":2534}]},{"tag_name":"9.5.6","name":"Kotatsu 9.5.6","prerelease":false,"published_at":"2025-12-28T12:37:54Z","html_url":"https://github.com/Kotatsu-Redo/Kotatsu-Redo/releases/tag/9.5.6","assets":[{"name":"app-release.apk","size":14170235,"browser_download_url":"https://github.com/Kotatsu-Redo/Kotatsu-Redo/releases/download/9.5.6/app-release.apk","content_type":"application/vnd.android.package-archive","download_count":969}]},{"tag_name":"Nightly-28122025","name":"Nightly 28/12/2025","prerelease":true,"published_at":"2025-12-28T18:14:57Z","html_url":"https://github.com/Kotatsu-Redo/Kotatsu-Redo/releases/tag/Nightly-28122025","assets":[{"name":"app-release.apk","size":14187958,"browser_download_url":"https://github.com/Kotatsu-Redo/Kotatsu-Redo/releases/download/Nightly-28122025/app-release.apk","content_type":"application/vnd.android.package-archive","download_count":45}]},{"tag_name":"9.5.5","name":"Kotatsu 9.5.5","prerelease":false,"published_at":"2025-12-14T20:07:32Z","html_url":"https://github.com/Kotatsu-Redo/Kotatsu-Redo/releases/tag/9.5.5","assets":[{"name":"app-release.apk","size":14163310,"browser_download_url":"https://github.com/Kotatsu-Redo/Kotatsu-Redo/releases/download/9.5.5/app-release.apk","content_type":"application/vnd.android.package-archive","download_count":3499}]},{"tag_name":"9.5.4","name":"Kotatsu 9.5.4","prerelease":false,"published_at":"2025-12-14T10:32:07Z","html_url":"https://github.com/Kotatsu-Redo/Kotatsu-Redo/releases/tag/9.5.4","assets":[{"name":"app-release.apk","size":14162725,"browser_download_url":"https://github.com/Kotatsu-Redo/Kotatsu-Redo/releases/download/9.5.4/app-release.apk","content_type":"application/vnd.android.package-archive","download_count":551}]},{"tag_name":"Nightly-14122025","name":"Nightly 14/12/2025","prerelease":true,"published_at":"2025-12-14T17:43:55Z","html_url":"https://github.com/Kotatsu-Redo/Kotatsu-Redo/releases/tag/Nightly-14122025","assets":[{"name":"app-release.apk","size":14162402,"browser_download_url":"https://github.com/Kotatsu-Redo/Kotatsu-Redo/releases/download/Nightly-14122025/app-release.apk","content_type":"application/vnd.android.package-archive","download_count":33}]},{"tag_name":"Nightly-13122025","name":"Nightly 13/12/2025","prerelease":true,"published_at":"2025-12-13T18:49:50Z","html_url":"https://github.com/Kotatsu-Redo/Kotatsu-Redo/releases/tag/Nightly-13122025","assets":[{"name":"app-release.apk","size":14171080,"browser_download_url":"https://github.com/Kotatsu-Redo/Kotatsu-Redo/releases/download/Nightly-13122025/app-release.apk","content_type":"application/vnd.android.package-archive","download_count":44}]},{"tag_name":"Nightly-121220252","name":"Nightly 12/12/2025","prerelease":true,"published_at":"2025-12-12T21:04:29Z","html_url":"https://github.com/Kotatsu-Redo/Kotatsu-Redo/releases/tag/Nightly-121220252","assets":[{"name":"app-release.apk","size":14170615,"browser_download_url":"https://github.com/Kotatsu-Redo/Kotatsu-Redo/releases/download/Nightly-121220252/app-release.apk","content_type":"application/vnd.android.package-archive","download_count":39}]},{"tag_name":"Nightly-12122025","name":"Nightly 10/12/2025","prerelease":true,"published_at":"2025-12-10T16:05:20Z","html_url":"https://github.com/Kotatsu-Redo/Kotatsu-Redo/releases/tag/Nightly-12122025","assets":[{"name":"app-release.apk","size":14170233,"browser_download_url":"https://github.com/Kotatsu-Redo/Kotatsu-Redo/releases/download/Nightly-12122025/app-release.apk","content_type":"application/vnd.android.package-archive","download_count":61}]},{"tag_name":"9.5.3","name":"Kotatsu 9.5.3","prerelease":false,"published_at":"2025-12-09T10:26:55Z","html_url":"https://github.com/Kotatsu-Redo/Kotatsu-Redo/releases/tag/9.5.3","assets":[{"name":"app-release.apk","size":14169899,"browser_download_url":"https://github.com/Kotatsu-Redo/Kotatsu-Redo/releases/download/9.5.3/app-release.apk","content_type":"application/vnd.android.package-archive","download_count":1980}]},{"tag_name":"Nigthly-08122025","name":"Nightly 08/12/2025","prerelease":true,"published_at":"2025-12-08T22:33:57Z","html_url":"https://github.com/Kotatsu-Redo/Kotatsu-Redo/releases/tag/Nigthly-08122025","assets":[{"name":"app-release.apk","size":14169925,"browser_download_url":"https://github.com/Kotatsu-Redo/Kotatsu-Redo/releases/download/Nigthly-08122025/app-release.apk","content_type":"application/vnd.android.package-archive","download_count":44}]},{"tag_name":"Nightly-05122025","name":"Nightly 05/12/2025","prerelease":true,"published_at":"2025-12-05T22:37:44Z","html_url":"https://github.com/Kotatsu-Redo/Kotatsu-Redo/releases/tag/Nightly-05122025","assets":[{"name":"app-release.apk","size":14169482,"browser_download_url":"https://github.com/Kotatsu-Redo/Kotatsu-Redo/releases/download/Nightly-05122025/app-release.apk","content_type":"application/vnd.android.package-archive","download_count":107}]}]